[
  {
    "metadata": {
      "document_id": "1",
      "extraction_time": "2024-12-04T00:13:41.197599",
      "version": "1.0"
    },
    "document_info": {
      "document_type": "TỜ TRÌNH",
      "document_number": "391-TTr/VTCCB-TH",
      "issue_location": "Hà Nội",
      "issue_date": "28/11/2017",
      "issuing_agency": null,
      "recipients": "Đồng chí Hoàng Công Hoàn,\nPhó Chánh Văn phòng Thường trực,",
      "recipient_address": "K/T VỤ TRƯỞNG\n- Như trên, PHÓ VỤ TRƯỞNG\n- Đ/c Vụ trưởng (đề b/c),",
      "signer": null,
      "position": null,
      "subject": "cử cán bộ tham gia Đoàn Nhà xuất bản Chính trị quốc gia\nđi công tác tại Lào",
      "content": "VĂN PHÒNG TRUNG ƯƠNG ĐẢNG ĐĂNG CỘNG SẢN VIỆT NAM\n\nVỤ TỎ CHỨC - CÁN BỘ\n* Hà Nội, ngày 28 tháng 11 năm 2017\nSố 391-TTr/VTCCB-TH.\n\nVĂN PHÒNG TRUNG ƯƠNG\n\nKính gửi Đồng chí Hoàng Công Hoàn,\nPhó Chánh Văn phòng Thường trực,\n\nTỜ TRÌNH,\nV/v cử cán bộ tham gia Đoàn Nhà xuất bản Chính trị quốc gia\nđi công tác tại Lào\n\nNhà xuất bản Chính trị quốc gia Sự thật đề nghị Văn phòng Trung\nương Đảng cử 01 đồng chí đại diện lãnh đạo Cục Tài chính và Quản lý đầu\ntư và 02 đồng chí đại diện lãnh đạo Công ty In Tiến Bộ tham gia Đoàn liên\ncơ quan do Nhà xuất bản Chính trị quốc gia tổ chức đi thăm, bàn giao các\nhạng mục của dự án “Đầu tư thiết bị in và đào tạo cán bộ biên tập, công\nnhân in và đầu tư nâng cao năng lực biên tập, xuất bản, in ấn, phát hành”\ntại Lào; thời gian dự kiến từ ngày 10/12 đến ngày 15/12/2017. Kinh phí\nchuyến đi do Nhà xuất bản Chính trị quốc gia Sự thật bảo đảm (tại Công\nvăn số 618-CV/NXBCTQG và Công văn số 621-CV/NXBCTQG, ngày\n12/10/2017).\n\nCục Tài chính và Quản lý đầu tư đề xuất cử đồng chí Phan Thị Thủ\nHà, Phó Trưởng phòng Quản lý đầu tư tham gia Đoàn. Đồng chí Bùi Văn\nThạch, Phó Chánh Văn phòng đã đồng ý.\n\nCông ty In Tiến Bộ đề xuất cử đồng chí Nguyễn Đức Thanh, Chủ\ntịch Công ty và đồng chí Hà Sỹ Tuấn, Phó Giám đốc Công ty tham gia\nĐoàn (đồng chí Hà Sỹ Tuấn đã được lãnh đạo Văn phòng đồng ý để tham\ngia Đoàn của Công ty cô phần Xuất nhập khẩu ngành in đi tham quan triển\nlãm thiết bị, công nghệ ngành in tại Anh, trong tháng 10/2017 (Quyết định\n1851-QĐ/VPTW, ngày 12/10/2017 kèm theo). Tuy nhiên do phía Công ty\nXuất nhập khẩu ngành in không kịp hoàn tất các thủ tục nên không tổ chức\nđoàn đi Anh được).\n\nVề việc này, Vụ Tổ chức — Cán bộ xin báo cáo như sau:\n\nDự án “Đầu tư thiết bị in và đào tạo cán bộ biên tập, công nhân in và\nviệc đầu tư nâng cao năng lực biên tập, xuất bản, in ấn, phát hành” là dự án\ndo Thường trực Ban Bí thư quyết định, thực hiện bằng nguồn vốn ngân\n\nsách Đảng, trao tặng cho Nhà xuất bản và Phát hành sách quốc gia Lào.\nMột phần dự án (cung cấp thiết bị in và đào tạo công nhân in) được giao\ncho Công ty In Tiến Bộ thực hiện. Sau khi hoàn thành các hạng mục được\ngiao, lãnh đạo Văn phòng đã cử đồng chí Nguyễn Việt Tuấn, Giám đốc\nCông ty TNHH MTV In Tiến Bộ đi công tác tại Lào để bàn giao dây\nchuyền, thiết bị in cho phía Bạn quản lý, khai thác.\n\nĐoàn đi Lào lần này là đoàn do Nhà xuất bản Chính trị quốc gia tổ\nchức; mục đích là thăm, bàn giao các hạng mục dự án đã hoàn thành nhân\ndịp kỷ niệm 55 năm Ngày thiết lập quan hệ ngoại giao Việt Nam — Lào và\n40 năm Ngày ký Hiệp hước Hữu nghị và Hợp tác Việt Nam — Lào, Lào —\nViệt Nam.\n\nDo mục đích chuyến đi, nội dung làm việc và cơ quan chủ trì khác\n\n_ với các đoàn trước đây, vì vậy lãnh đạo Văn phòng có thể xem xét cử các\nđồng chí có tên sau tham gia Đoàn:\n\n1- Đồng chí Nguyễn Đức Thanh, Chủ tịch Công ty In Tiến Bộ.\n\n2- Đồng chí Hà Sỹ Tuấn, Phó Giám đốc Công ty In Tiến Bộ.\n\n3- Đồng chí Phan Thị Thu Hà, Phó Trưởng phòng Quản lý đầu tư,\nCục Tài chính và Quản lý đầu tư.\n\nKính trình Đồng chí xem xét, cho ý kiến.\n\nNơi nhận: K/T VỤ TRƯỞNG\n- Như trên, PHÓ VỤ TRƯỞNG\n- Đ/c Vụ trưởng (đề b/c),\n\n- Lưu Phòng Tổng hợp.\n\nDương Thị Hiền",
      "page_numbers": [
        1,
        2
      ]
    }
  },
  {
    "metadata": {
      "document_id": "2",
      "extraction_time": "2024-12-04T00:13:41.197599",
      "version": "1.0"
    },
    "document_info": {
      "document_type": "TỜ TRÌNH",
      "document_number": "618-",
      "issue_location": "Hà Nội",
      "issue_date": "16/11/2017",
      "issuing_agency": "VĂN PHÒNG TRƯNG ƯƠNG ĐẢNG CỘNG SẢN VIỆT NAM\nCỤC TÀI CHÍNH VÀ QUẢN LÝ ĐẦU TƯ RE",
      "recipients": "- Lãnh đạo Văn phòng Trung ương Đảng;\n- Vụ Tổ chức - Cán bộ.",
      "recipient_address": null,
      "signer": null,
      "position": null,
      "subject": null,
      "content": "VĂN PHÒNG TRƯNG ƯƠNG ĐẢNG CỘNG SẢN VIỆT NAM\nCỤC TÀI CHÍNH VÀ QUẢN LÝ ĐẦU TƯ RE\n* Hà Nội, ngày 16 tháng 11 năm 2017\n\n35-TTr/CTC&QLĐT\n\nKính gửi: - Lãnh đạo Văn phòng Trung ương Đảng;\n- Vụ Tổ chức - Cán bộ.\nTỜ TRÌNH\nVề việc cử cán bộ tham gia Đoàn công tác\ncủa Nhà xuất bản Chính trị Quốc gia sự thật\n\n1/1/24, \"\n1 lC # Cục Tài chính và Quản lý đầu tư nhận được Văn bản số 618-\n-12€wnce, ngày 12/10/2017 của Nhà xuất bản Chính trị Quốc gia sự thật về\nZ việc đề nghị cử 01 đồng chí đại diện lãnh đạo Cục tham gia đoàn công tác liên cơ\nquan sang thăm và bàn giao các hạng mục của dự án: “Đầu tư thiết bị in và đào\ntạo cán bộ biên tập, công nhân in và việc đầu tư nâng cao năng lực biên tập, xuất\nbản, in ấn và phát hành” với nước bạn Lào.\n\nTheo kế hoạch của Văn phòng Trung ương Đảng, Cục tài chính và Quản lý\nđầu tư được phân công nhiệm vụ chuẩn bị nội dung phục vụ hội nghị toàn quốc\ncông tác tài chính Đảng và hoạt động sản xuất kinh doanh của Đảng, nên không\ncử đại diện lãnh đạo tham gia đoàn công tác trên được. Cục Tài chính và Quản lý\nđầu tư báo cáo và xin ý kiến Lãnh đạo Văn phòng Trung ương Đảng cử đồng chí\n\n- Phan Thị Thư Hà, Phó trưởng phòng Quản lý Đầu tư tham gia đoàn công tác.\n\nThời gian: Dự kiến 05 ngày (trung tuần tháng 12/2017).\n\nNguồn kinh phí thực hiện: Từ nguồn ngân sách Đảng theo quy định hiện hành.\n\nKính trình Lãnh đạo Văn phòng Trung ương Đảng, Vụ Tổ chức - Cán bộ\nxem xét và cho ý kiến chỉ đạo.\n\nNơi nhận :\n\n- Như trên,\n\n- Phòng THNS,\n- Lưu Cục.",
      "page_numbers": [
        3
      ]
    }
  },
  {
    "metadata": {
      "document_id": "3",
      "extraction_time": "2024-12-04T00:13:41.197599",
      "version": "1.0"
    },
    "document_info": {
      "document_type": "Công văn",
      "document_number": "64Ÿ",
      "issue_location": "Hà Nội",
      "issue_date": null,
      "issuing_agency": null,
      "recipients": ". - Văn phòng Trung ương Đảng;\nSối ày- / _ - Cục Tài chính và Quần lý đầu tư,",
      "recipient_address": null,
      "signer": null,
      "position": null,
      "subject": null,
      "content": "ĐẢNG CÔNG SẲN VIÊT NAM\n\nBAN CHÁP HÀNH TRƯNG ƯƠNG\nNHÀ XUẤT BẢN Hà Nội, ngàyA.2 tháng 10 năm 2017\nCHÍNH TRỊ QUỐC GIA SỰ THẬT\n*\n\nSố 64Ÿ - CV/NXBCTQG\nl“^' mời đại điện Lãnh đạo Cục Tài chính và Quản Ùÿ\n¬ đâu tư tham gia Đoàn Nhà xuất bản đi công tác tại Lào \"\nVĂN PHÒNG TRUNG ƯƠNG ⁄\nĐẾN Kính gửi. - Văn phòng Trung ương Đảng;\nSối ày- / _ - Cục Tài chính và Quần lý đầu tư,\n\n|Chuyển: % 1\n\nD1-9-2017, Văn phòng Trung ương Đảng đã có Công văn số 4685-\nCW/VPTW truyền đạt ý kiến của đồng chí Thường trực Ban Bí thư cử đoàn cán bộ\n⁄ 4l liên cơ quan (gồm 06 người) do đồng chí Phạm Chí Thành, Quyển Giám đốc -\nđj ⁄/ Tông Biên tập Nhà xuất bản Chính trị quốc gia Sự thật làm Trưởng đoàn đi công\nđƒIp u4fL⁄ __ tác tại Lào, thời gian 05 ngày, cụ thể như sau:\n\n1. Mục đích chuyến đi: Nhân dịp kỷ niệm 55 năm Ngày thiết lập quan hệ\nngoại giao Việt Nam - Lào và 40 năm Ngày ký Hiệp ước Hữu nghị và Hợp tác\ngiữa Việt Nam - Lào, Lào - Việt Nam, Đoàn liên cơ quan (Nhà xuất bản Chính trị\nquốc gia Sự thật, Cục tài chính và Quản lý đầu tư, Văn phòng Trung ương, Công ty\n\nˆ In Tiến Bộ) sang thăm và bàn giao các hạng mục của dự án “Đầu # thiết bị in và\nđào tạo cắn bộ biên tập, công nhân in và việc đầu tư nâng cao năng lực biên tập,\nxuất bản, in ấn, phát hành” của Đảng và Nhà nước Việt Nam trao tặng cho Nhà\nxuất bản và Phát hành sách Quốc gia Lào;\n\n2. Kế hoạch đoàn đi: Trung tuần tháng 12-2017 (dự kiến từ 10 đến 15-12)\n\n3. Kinh phí: Ngân sách Đảng theo quy định hiện hành.\n\nNhà xuất bản Chính trị quốc gia Sự thật trân trọng đề nghị Văn phòng Trung\nương Đảng cử 01 đồng chí đại diện lãnh đạo Cục Tài chính và Quản lý đầu tư tham\ngia Đoàn công tác. ,\n\nXin cảm ơn.\n\nNơi nhân: .\n- Như trên;\n- Lưu VT,\n\nam Chí Thành",
      "page_numbers": [
        4
      ]
    }
  },
  {
    "metadata": {
      "document_id": "4",
      "extraction_time": "2024-12-04T00:13:41.197599",
      "version": "1.0"
    },
    "document_info": {
      "document_type": "quyết định",
      "document_number": "1851-QĐ/VPTW",
      "issue_location": "Hà Nội",
      "issue_date": "12",
      "issuing_agency": "VĂN PHÒNG TRUNG ƯƠNG ĐẲNG CỘNG HOÀ XÃ HỘI CHỦ NGHĨA VIỆT NAM\n: CÔNGTYTNHH ` ._ Độc lập - Tự do - Hạnh phúc",
      "recipients": "- Lãnh đạo Văn phòng Trung ương; Z.\n- Vụ Tổ chức - Cán bộ. .",
      "recipient_address": null,
      "signer": null,
      "position": null,
      "subject": null,
      "content": "VĂN PHÒNG TRUNG ƯƠNG ĐẲNG CỘNG HOÀ XÃ HỘI CHỦ NGHĨA VIỆT NAM\n: CÔNGTYTNHH ` ._ Độc lập - Tự do - Hạnh phúc\n\n- MỘT THÀNH VIÊN IN TIẾN BỘ TT ,\nHà Nội, ngày 01 tháng I1 năm 2017\n\nï\n\nKính gửi: - Lãnh đạo Văn phòng Trung ương; Z.\n- Vụ Tổ chức - Cán bộ. .\n\nuất bản Chính trị Quốc gia Sự thật có văn bản số 621-\n\n\" P /NXCTQG, ngày 12/10/2017 để nghị Công ty In Tiến Bộ cử 2 đồng chí\n\nđạo đi bàn giao dự án \" Đâu tư thiết bị in và đào tạo cán bộ biên tập, công\n\nnhân in và việc đầu tư nâng cao năng lực biên tập, xuất bản, in ấn, phát hành\"\n\n“ế Ƒ và ký biên bản với cáeƠơ quan của Lào làm chứng từ quyết toán dự án được lãnh\nđạo Văn ø Trung ương giao cho Công ty In Tiến Bộ làm chủ đầu tư.\n\nCông ty In Tiến Bộ để nghị lãnh đạo Văn phòng Trung ương cho phép\nđông chí Nguyễn Đức Thanh, Chủ tịch Công ty và đồng chí Hà % Tuấn, Phó\nGiám đốc Công ty tham gia đoàn với Nhà Xuất bản Chính trị Quốc gia Sự thật,\nthời gian dự kiến từ ngày 10/12 đến 15/12/2017. Kinh phí chuyến đi do Ngân\nsách Đảng chỉ theo quy định,\n\nTrường hợp đồng chí Hà Sĩ Tuấn đã được lãnh đạo Văn phòng Trung ương\ncó quyết định cử đi công tác tại Vương Quốc Anh theo lời mời của Công ty Cổ\nphân xuất nhập khẩu ngành ¡in (Quyết định số 1851-QĐ/VPTW, ngày\n12/10/2017). Do Công ty Cổ phân xuất nhập khẩu ngành in có Công văn số 61\nCV-XNKN, ngày 27/10/2017đề nghị hoãn chuyến đi (xin gửi kèm công văn) nên\nđồng chí Hà Sĩ Tuấn đã không tham gia chuyến công tác trên.\n\nKính trình lãnh đạo Văn phòng Trung ương xem xét quyết định.\n\nNơi nhận:\n- Như trên,\n- Lưu Văn phòngCông ty.\n",
      "page_numbers": [
        5
      ]
    }
  },
  {
    "metadata": {
      "document_id": "5",
      "extraction_time": "2024-12-04T00:13:41.197599",
      "version": "1.0"
    },
    "document_info": {
      "document_type": "Quyết định",
      "document_number": "1851-QĐ/VPTW",
      "issue_location": "Hà Nội",
      "issue_date": "12/10/2017",
      "issuing_agency": "BAN CHÁP HÀNH NUNG ƯƠNG ĐÁNG CỘNG SẢN VIỆT NAM\nv rH NG Hà Nội, ngày 12 tháng 10 năm 2017",
      "recipients": null,
      "recipient_address": "K/T CHÁNH VĂN PHÒNG\n- Như Điều 3, PHÓ CDHASTTERNVPHÒNG THƯỜNG TRỰC\n- Đồng chí Chánh Văn phòng S -",
      "signer": null,
      "position": null,
      "subject": null,
      "content": "BAN CHÁP HÀNH NUNG ƯƠNG ĐÁNG CỘNG SẢN VIỆT NAM\nv rH NG Hà Nội, ngày 12 tháng 10 năm 2017\nSố 1851-QĐ/VPTW\n\nQUYÉT ĐỊNH\nvề việc cán bộ đi tham dự triển lãm ở nước ngoài\n\n- Căn cứ Quyết định số 189-QĐ/TW, ngày 10/4/2013 của Bộ Chính trị\nkhoá XI về chức năng, nhiệm vụ, tổ chức bộ máy của Văn phòng Trung\nương Đảng;\n\n- Căn cứ Công văn số 57/2017/CV-XNKI, ngày 18/9/2017 của Công ty\ncổ phần Xuất nhập khẩu ngành in về việc mời cán bộ đi tham dự triển lãm\nIPEX tại Anh;\n\n- Xét đề nghị của Vụ trưởng Vụ Tổ chức - Cán bộ,\n\nCHÁNH VĂN PHÒNG TRUNG ƯƠNG ĐẢNG\nQUYÉT ĐỊNH\n\nĐiều 1. Đồng ý để đồng chí Hà Sỹ Tuấn, Phó Giám đốc Công ty trách\nnhiệm hữu hạn một thành viên In Tiến Bộ (lương Phó Giám đốc công ty\nhạng II, bậc 2/2, hệ số 5,65) tham gia Đoàn của Công ty cổ phần Xuất nhập\nkhẩu ngành in đi tham quan triển lãm thiết bị, công nghệ ngành in IPEX 2017\ntại Anh, thời gian dự kiến 10 ngày, từ ngày 25/10/2017.\n\nĐiều 2. Kinh phí chuyến đi do Công ty cổ phần Xuất nhập khẩu ngành\nin bảo đảm.\n\nĐiều 3. Vụ trưởng Vụ Tổ chức - Cán bộ, Giám đốc Công ty trách nhiệm\nhữu hạn một thành viên In Tiến BỹS⁄à đồng chí Hà Sỹ Tuấn thi hành Quyết\nđịnh này.\n\nNơi nhận: K/T CHÁNH VĂN PHÒNG\n- Như Điều 3, PHÓ CDHASTTERNVPHÒNG THƯỜNG TRỰC\n- Đồng chí Chánh Văn phòng S -\n\nTrung ương Đảng (để báo cáo),\n- Công ty cỗ p : “\n\nXuất nhập khẩu ngành in,\n- Cục Lãnh sự, Bộ Ngoại giao,\n- Công ty In Tiến Bộ,\n\nCục Quản trị - Tài vụ,\n- Lưu Văn phòng Trung ương Đảng. Hoàng Công Hoàn.\n\n10.QDVP1851.DOC",
      "page_numbers": [
        6
      ]
    }
  },
  {
    "metadata": {
      "document_id": "6",
      "extraction_time": "2024-12-04T00:13:41.197599",
      "version": "1.0"
    },
    "document_info": {
      "document_type": "tờ trình",
      "document_number": "61/CV-XNKNI",
      "issue_location": "Hà Nội",
      "issue_date": "27/10/2017",
      "issuing_agency": "BỘ VĂN HÓA-THẺ THAO-DU LỊCH CỌNG HOÀ XÃ HỘI CHỦ NGHĨA VIỆT NAM\nCÔNG TY CỎ PHẢÀN XUẤT NHẬP Độc lập - Tự do - Hạnh phúc",
      "recipients": "Công ty TNHH một thành viên in Tiến Bộ",
      "recipient_address": null,
      "signer": null,
      "position": null,
      "subject": null,
      "content": "BỘ VĂN HÓA-THẺ THAO-DU LỊCH CỌNG HOÀ XÃ HỘI CHỦ NGHĨA VIỆT NAM\nCÔNG TY CỎ PHẢÀN XUẤT NHẬP Độc lập - Tự do - Hạnh phúc\nKHẢU NGÀNH IN ———————\n\nF Hà Nội, ngày 27 tháng 10 năm 2017\n\nSố: 61/CV-XNKNI ,@ S\n\n( ⁄% Hoãn chuyên công lác tại\nAnh Quốc )\n\nKính gửi : Công ty TNHH một thành viên in Tiến Bộ\n\nNgày 18 tháng 9 năm 2017 Chúng tôi có mời. đồng chí Lão đạo Công ty đi dự\nhội trợ triển lãm về in ấn tại Anh Quốc . Công ty in Tiến Bộ đã trao đôi và gửi các\nthông tin để 02 bên phối hợp xin cấp VISA cho chuyến \\ công tác của đồng chí Hà Sĩ\nTuần phó giám đốc Công ty.\n\nĐược biết Công ty In Tiến Bộ đã làm tờ trình và được lãnh đạo Văn phòng\nTrung ương Đảng đồng ý cử đồng chí Hà Sĩ Tuấn Phó Giám đốc đi dự triển lãnh trên.\n\nTuy nhiên trong quá trình xin triển khai công việc để cấp VISA để vào Anh\nQuốc, do thời gian chuẩn bị quá gấp, một số giấy mời từ Anh Quốc chuyển về gặp\ntrục trặc chúng tôi không còn kịp thời gian làm thủ tục VISA cho đoàn, vì vậy không\ntô chức đoàn đi dự triển lãm tại Anh Quốc được.\n\nBằng văn bản này Công ty chúng tôi xin lỗi phía Công ty và mong nhận được\nsự thông cảm vì sự cố đáng tiếc trên và hy vọng trong thời gian tới sẽ có địp tổ chức\ncùng với sự tham gia của đại diện Quí công ty trong chuyến đi khác thật chu đáo và\ncó kết quả tốt đẹp .\n\nXin trân trọng cảm ơn.\nMXơi nhận.\n\n- Như trên;\n- Lưu VP.",
      "page_numbers": [
        7
      ]
    }
  },
  {
    "metadata": {
      "document_id": "7",
      "extraction_time": "2024-12-04T00:13:41.197599",
      "version": "1.0"
    },
    "document_info": {
      "document_type": "Công văn",
      "document_number": "4685-",
      "issue_location": "Hà Nội",
      "issue_date": null,
      "issuing_agency": "BẠN CHÁP HÀNH TRUNG ƯƠNG ĐÁNG CÔNG SẢN VIỆT NAM .\nNHÀ XUÁT BẢN Hà Nội, ngày42_ tháng 10 năm 2017",
      "recipients": "Công ty TNHH In Tiến Bộ,\nM_„zP",
      "recipient_address": null,
      "signer": null,
      "position": null,
      "subject": null,
      "content": "BẠN CHÁP HÀNH TRUNG ƯƠNG ĐÁNG CÔNG SẢN VIỆT NAM .\nNHÀ XUÁT BẢN Hà Nội, ngày42_ tháng 10 năm 2017\nCHÍNH TRỊ QUỐC GIA SỰ THẬT\n\n*\n\nSó ố.24 - CV/NXBCTQG\nW% mời đại điện Lãnh đạo Công tụ TNHH In Tiến Bộ\ntham .. + Nhà \"àa tới ai công tác tại Lào\n\n‡hỉ Hai Kính gửi: Công ty TNHH In Tiến Bộ,\nM_„zP\n\nNgày 01-9-2017, Văn phòng Trung ương Đảng đã có Công văn số 4685-\n\nuư” CEV/VPTW truyền đạt ý kiến của đồng chí Thường trực Ban Bí thư cử đoàn cán bộ\nan (gồm 06 người) do đồng chí Phạm Chí Thành, Quyền Giám đốc -\n\nBiên tập Nhà xuất bản Chính trị quốc gia Sự thật làm Trưởng đoàn đi công\n\nác tại Lào, thời gian 05 ngày, cụ thể như sau:\n\n1. Mục đích chuyến đi: Nhân dịp kỷ niệm 55 năm Ngày thiết lập quan hệ\nngoại giao Việt Nam - Lào và 40 năm Ngày ký Hiệp ước Hữu nghị và Hợp tác\ngiữa Việt Nam - Lào, Lào - Việt Nam, Đoàn liên cơ quan (Nhà xuất bản Chính trị\nquốc gia Sự thật, Cục tài chính và quản lý đầu tư, Văn phòng Trung ương, Công ty\nIn Tiến Bộ) sang thăm và bàn giao các hạng mục của dự án “Đâu £ thiết bị in và\nđào tạo cán bộ biên tập, công nhân in và việc đầu tư nâng cao năng lực biên tập,\nxuẤt bản, in ấn, phát hành” của Đảng và Nhà nước Việt Nam trao tặng cho Nhà\nxuất bản và Phát hành sách Quốc gia Lào;\n\n2. Kế hoạch đoàn đi: Trung tuần tháng 12-2017 (dự kiến từ 10 đến 15-12);\n\n3. Kinh phí: Ngân sách Đảng theo quy định hiện hành.\n\nNhà xuất bản Chính trị quốc gia Sự thật trân trọng đề nghị Công ty TNHH\nIn Tiến Bộ cử 02 đồng chí đại diện lãnh đạo Công ty tham gia Đoàn công tác.\nXin cảm ơn.\n\nNơi nhân:\n- Như trên;\n- Lưu VT.\n\nQ.GIÁM| ĐỐC - TỔNG BIÊN TẬP „_~\n\ná Ấc\n(HÌTRỊgtý (9i U)\n\n^SVTi KỢ,,\ns4 Thành",
      "page_numbers": [
        8
      ]
    }
  }
]