{
  "metadata": {
    "document_id": "1",
    "extraction_time": "2024-12-04T00:04:34.687757",
    "version": "1.0"
  },
  "document_info": {
    "document_type": "TỜ TRÌNH",
    "document_number": "391-TTr/VTCCB-TH",
    "issue_location": "Hà Nội",
    "issue_date": "28/11/2017",
    "issuing_agency": null,
    "recipients": "Đồng chí Hoàng Công Hoàn,\nPhó Chánh Văn phòng Thường trực,",
    "recipient_address": "K/T VỤ TRƯỞNG\n- Như trên, PHÓ VỤ TRƯỞNG\n- Đ/c Vụ trưởng (đề b/c),",
    "signer": null,
    "position": null,
    "subject": "cử cán bộ tham gia Đoàn Nhà xuất bản Chính trị quốc gia\nđi công tác tại Lào",
    "content": "VĂN PHÒNG TRUNG ƯƠNG ĐẢNG ĐĂNG CỘNG SẢN VIỆT NAM\n\nVỤ TỎ CHỨC - CÁN BỘ\n* Hà Nội, ngày 28 tháng 11 năm 2017\nSố 391-TTr/VTCCB-TH.\n\nVĂN PHÒNG TRUNG ƯƠNG\n\nKính gửi Đồng chí Hoàng Công Hoàn,\nPhó Chánh Văn phòng Thường trực,\n\nTỜ TRÌNH,\nV/v cử cán bộ tham gia Đoàn Nhà xuất bản Chính trị quốc gia\nđi công tác tại Lào\n\nNhà xuất bản Chính trị quốc gia Sự thật đề nghị Văn phòng Trung\nương Đảng cử 01 đồng chí đại diện lãnh đạo Cục Tài chính và Quản lý đầu\ntư và 02 đồng chí đại diện lãnh đạo Công ty In Tiến Bộ tham gia Đoàn liên\ncơ quan do Nhà xuất bản Chính trị quốc gia tổ chức đi thăm, bàn giao các\nhạng mục của dự án “Đầu tư thiết bị in và đào tạo cán bộ biên tập, công\nnhân in và đầu tư nâng cao năng lực biên tập, xuất bản, in ấn, phát hành”\ntại Lào; thời gian dự kiến từ ngày 10/12 đến ngày 15/12/2017. Kinh phí\nchuyến đi do Nhà xuất bản Chính trị quốc gia Sự thật bảo đảm (tại Công\nvăn số 618-CV/NXBCTQG và Công văn số 621-CV/NXBCTQG, ngày\n12/10/2017).\n\nCục Tài chính và Quản lý đầu tư đề xuất cử đồng chí Phan Thị Thủ\nHà, Phó Trưởng phòng Quản lý đầu tư tham gia Đoàn. Đồng chí Bùi Văn\nThạch, Phó Chánh Văn phòng đã đồng ý.\n\nCông ty In Tiến Bộ đề xuất cử đồng chí Nguyễn Đức Thanh, Chủ\ntịch Công ty và đồng chí Hà Sỹ Tuấn, Phó Giám đốc Công ty tham gia\nĐoàn (đồng chí Hà Sỹ Tuấn đã được lãnh đạo Văn phòng đồng ý để tham\ngia Đoàn của Công ty cô phần Xuất nhập khẩu ngành in đi tham quan triển\nlãm thiết bị, công nghệ ngành in tại Anh, trong tháng 10/2017 (Quyết định\n1851-QĐ/VPTW, ngày 12/10/2017 kèm theo). Tuy nhiên do phía Công ty\nXuất nhập khẩu ngành in không kịp hoàn tất các thủ tục nên không tổ chức\nđoàn đi Anh được).\n\nVề việc này, Vụ Tổ chức — Cán bộ xin báo cáo như sau:\n\nDự án “Đầu tư thiết bị in và đào tạo cán bộ biên tập, công nhân in và\nviệc đầu tư nâng cao năng lực biên tập, xuất bản, in ấn, phát hành” là dự án\ndo Thường trực Ban Bí thư quyết định, thực hiện bằng nguồn vốn ngân\n\nsách Đảng, trao tặng cho Nhà xuất bản và Phát hành sách quốc gia Lào.\nMột phần dự án (cung cấp thiết bị in và đào tạo công nhân in) được giao\ncho Công ty In Tiến Bộ thực hiện. Sau khi hoàn thành các hạng mục được\ngiao, lãnh đạo Văn phòng đã cử đồng chí Nguyễn Việt Tuấn, Giám đốc\nCông ty TNHH MTV In Tiến Bộ đi công tác tại Lào để bàn giao dây\nchuyền, thiết bị in cho phía Bạn quản lý, khai thác.\n\nĐoàn đi Lào lần này là đoàn do Nhà xuất bản Chính trị quốc gia tổ\nchức; mục đích là thăm, bàn giao các hạng mục dự án đã hoàn thành nhân\ndịp kỷ niệm 55 năm Ngày thiết lập quan hệ ngoại giao Việt Nam — Lào và\n40 năm Ngày ký Hiệp hước Hữu nghị và Hợp tác Việt Nam — Lào, Lào —\nViệt Nam.\n\nDo mục đích chuyến đi, nội dung làm việc và cơ quan chủ trì khác\n\n_ với các đoàn trước đây, vì vậy lãnh đạo Văn phòng có thể xem xét cử các\nđồng chí có tên sau tham gia Đoàn:\n\n1- Đồng chí Nguyễn Đức Thanh, Chủ tịch Công ty In Tiến Bộ.\n\n2- Đồng chí Hà Sỹ Tuấn, Phó Giám đốc Công ty In Tiến Bộ.\n\n3- Đồng chí Phan Thị Thu Hà, Phó Trưởng phòng Quản lý đầu tư,\nCục Tài chính và Quản lý đầu tư.\n\nKính trình Đồng chí xem xét, cho ý kiến.\n\nNơi nhận: K/T VỤ TRƯỞNG\n- Như trên, PHÓ VỤ TRƯỞNG\n- Đ/c Vụ trưởng (đề b/c),\n\n- Lưu Phòng Tổng hợp.\n\nDương Thị Hiền",
    "page_numbers": [
      1,
      2
    ]
  }
}