{
  "metadata": {
    "document_id": "5",
    "extraction_time": "2024-12-04T00:13:41.197599",
    "version": "1.0"
  },
  "document_info": {
    "document_type": "Quyết định",
    "document_number": "1851-QĐ/VPTW",
    "issue_location": "Hà Nội",
    "issue_date": "12/10/2017",
    "issuing_agency": "BAN CHÁP HÀNH NUNG ƯƠNG ĐÁNG CỘNG SẢN VIỆT NAM\nv rH NG Hà Nội, ngày 12 tháng 10 năm 2017",
    "recipients": null,
    "recipient_address": "K/T CHÁNH VĂN PHÒNG\n- Như Điều 3, PHÓ CDHASTTERNVPHÒNG THƯỜNG TRỰC\n- Đồng chí Chánh Văn phòng S -",
    "signer": null,
    "position": null,
    "subject": null,
    "content": "BAN CHÁP HÀNH NUNG ƯƠNG ĐÁNG CỘNG SẢN VIỆT NAM\nv rH NG Hà Nội, ngày 12 tháng 10 năm 2017\nSố 1851-QĐ/VPTW\n\nQUYÉT ĐỊNH\nvề việc cán bộ đi tham dự triển lãm ở nước ngoài\n\n- Căn cứ Quyết định số 189-QĐ/TW, ngày 10/4/2013 của Bộ Chính trị\nkhoá XI về chức năng, nhiệm vụ, tổ chức bộ máy của Văn phòng Trung\nương Đảng;\n\n- Căn cứ Công văn số 57/2017/CV-XNKI, ngày 18/9/2017 của Công ty\ncổ phần Xuất nhập khẩu ngành in về việc mời cán bộ đi tham dự triển lãm\nIPEX tại Anh;\n\n- Xét đề nghị của Vụ trưởng Vụ Tổ chức - Cán bộ,\n\nCHÁNH VĂN PHÒNG TRUNG ƯƠNG ĐẢNG\nQUYÉT ĐỊNH\n\nĐiều 1. Đồng ý để đồng chí Hà Sỹ Tuấn, Phó Giám đốc Công ty trách\nnhiệm hữu hạn một thành viên In Tiến Bộ (lương Phó Giám đốc công ty\nhạng II, bậc 2/2, hệ số 5,65) tham gia Đoàn của Công ty cổ phần Xuất nhập\nkhẩu ngành in đi tham quan triển lãm thiết bị, công nghệ ngành in IPEX 2017\ntại Anh, thời gian dự kiến 10 ngày, từ ngày 25/10/2017.\n\nĐiều 2. Kinh phí chuyến đi do Công ty cổ phần Xuất nhập khẩu ngành\nin bảo đảm.\n\nĐiều 3. Vụ trưởng Vụ Tổ chức - Cán bộ, Giám đốc Công ty trách nhiệm\nhữu hạn một thành viên In Tiến BỹS⁄à đồng chí Hà Sỹ Tuấn thi hành Quyết\nđịnh này.\n\nNơi nhận: K/T CHÁNH VĂN PHÒNG\n- Như Điều 3, PHÓ CDHASTTERNVPHÒNG THƯỜNG TRỰC\n- Đồng chí Chánh Văn phòng S -\n\nTrung ương Đảng (để báo cáo),\n- Công ty cỗ p : “\n\nXuất nhập khẩu ngành in,\n- Cục Lãnh sự, Bộ Ngoại giao,\n- Công ty In Tiến Bộ,\n\nCục Quản trị - Tài vụ,\n- Lưu Văn phòng Trung ương Đảng. Hoàng Công Hoàn.\n\n10.QDVP1851.DOC",
    "page_numbers": [
      6
    ]
  }
}