{
  "metadata": {
    "document_id": "2",
    "extraction_time": "2024-12-04T00:13:19.587291",
    "version": "1.0"
  },
  "document_info": {
    "document_type": "TỜ TRÌNH",
    "document_number": "618-",
    "issue_location": "Hà Nội",
    "issue_date": "16/11/2017",
    "issuing_agency": "VĂN PHÒNG TRƯNG ƯƠNG ĐẢNG CỘNG SẢN VIỆT NAM\nCỤC TÀI CHÍNH VÀ QUẢN LÝ ĐẦU TƯ RE",
    "recipients": "- Lãnh đạo Văn phòng Trung ương Đảng;\n- Vụ Tổ chức - Cán bộ.",
    "recipient_address": null,
    "signer": null,
    "position": null,
    "subject": null,
    "content": "VĂN PHÒNG TRƯNG ƯƠNG ĐẢNG CỘNG SẢN VIỆT NAM\nCỤC TÀI CHÍNH VÀ QUẢN LÝ ĐẦU TƯ RE\n* Hà Nội, ngày 16 tháng 11 năm 2017\n\n35-TTr/CTC&QLĐT\n\nKính gửi: - Lãnh đạo Văn phòng Trung ương Đảng;\n- Vụ Tổ chức - Cán bộ.\nTỜ TRÌNH\nVề việc cử cán bộ tham gia Đoàn công tác\ncủa Nhà xuất bản Chính trị Quốc gia sự thật\n\n1/1/24, \"\n1 lC # Cục Tài chính và Quản lý đầu tư nhận được Văn bản số 618-\n-12€wnce, ngày 12/10/2017 của Nhà xuất bản Chính trị Quốc gia sự thật về\nZ việc đề nghị cử 01 đồng chí đại diện lãnh đạo Cục tham gia đoàn công tác liên cơ\nquan sang thăm và bàn giao các hạng mục của dự án: “Đầu tư thiết bị in và đào\ntạo cán bộ biên tập, công nhân in và việc đầu tư nâng cao năng lực biên tập, xuất\nbản, in ấn và phát hành” với nước bạn Lào.\n\nTheo kế hoạch của Văn phòng Trung ương Đảng, Cục tài chính và Quản lý\nđầu tư được phân công nhiệm vụ chuẩn bị nội dung phục vụ hội nghị toàn quốc\ncông tác tài chính Đảng và hoạt động sản xuất kinh doanh của Đảng, nên không\ncử đại diện lãnh đạo tham gia đoàn công tác trên được. Cục Tài chính và Quản lý\nđầu tư báo cáo và xin ý kiến Lãnh đạo Văn phòng Trung ương Đảng cử đồng chí\n\n- Phan Thị Thư Hà, Phó trưởng phòng Quản lý Đầu tư tham gia đoàn công tác.\n\nThời gian: Dự kiến 05 ngày (trung tuần tháng 12/2017).\n\nNguồn kinh phí thực hiện: Từ nguồn ngân sách Đảng theo quy định hiện hành.\n\nKính trình Lãnh đạo Văn phòng Trung ương Đảng, Vụ Tổ chức - Cán bộ\nxem xét và cho ý kiến chỉ đạo.\n\nNơi nhận :\n\n- Như trên,\n\n- Phòng THNS,\n- Lưu Cục.",
    "page_numbers": [
      3
    ]
  }
}