{
  "metadata": {
    "document_id": "6",
    "extraction_time": "2024-12-04T00:04:34.687757",
    "version": "1.0"
  },
  "document_info": {
    "document_type": "tờ trình",
    "document_number": "61/CV-XNKNI",
    "issue_location": "Hà Nội",
    "issue_date": "27/10/2017",
    "issuing_agency": "BỘ VĂN HÓA-THẺ THAO-DU LỊCH CỌNG HOÀ XÃ HỘI CHỦ NGHĨA VIỆT NAM\nCÔNG TY CỎ PHẢÀN XUẤT NHẬP Độc lập - Tự do - Hạnh phúc",
    "recipients": "Công ty TNHH một thành viên in Tiến Bộ",
    "recipient_address": null,
    "signer": null,
    "position": null,
    "subject": null,
    "content": "BỘ VĂN HÓA-THẺ THAO-DU LỊCH CỌNG HOÀ XÃ HỘI CHỦ NGHĨA VIỆT NAM\nCÔNG TY CỎ PHẢÀN XUẤT NHẬP Độc lập - Tự do - Hạnh phúc\nKHẢU NGÀNH IN ———————\n\nF Hà Nội, ngày 27 tháng 10 năm 2017\n\nSố: 61/CV-XNKNI ,@ S\n\n( ⁄% Hoãn chuyên công lác tại\nAnh Quốc )\n\nKính gửi : Công ty TNHH một thành viên in Tiến Bộ\n\nNgày 18 tháng 9 năm 2017 Chúng tôi có mời. đồng chí Lão đạo Công ty đi dự\nhội trợ triển lãm về in ấn tại Anh Quốc . Công ty in Tiến Bộ đã trao đôi và gửi các\nthông tin để 02 bên phối hợp xin cấp VISA cho chuyến \\ công tác của đồng chí Hà Sĩ\nTuần phó giám đốc Công ty.\n\nĐược biết Công ty In Tiến Bộ đã làm tờ trình và được lãnh đạo Văn phòng\nTrung ương Đảng đồng ý cử đồng chí Hà Sĩ Tuấn Phó Giám đốc đi dự triển lãnh trên.\n\nTuy nhiên trong quá trình xin triển khai công việc để cấp VISA để vào Anh\nQuốc, do thời gian chuẩn bị quá gấp, một số giấy mời từ Anh Quốc chuyển về gặp\ntrục trặc chúng tôi không còn kịp thời gian làm thủ tục VISA cho đoàn, vì vậy không\ntô chức đoàn đi dự triển lãm tại Anh Quốc được.\n\nBằng văn bản này Công ty chúng tôi xin lỗi phía Công ty và mong nhận được\nsự thông cảm vì sự cố đáng tiếc trên và hy vọng trong thời gian tới sẽ có địp tổ chức\ncùng với sự tham gia của đại diện Quí công ty trong chuyến đi khác thật chu đáo và\ncó kết quả tốt đẹp .\n\nXin trân trọng cảm ơn.\nMXơi nhận.\n\n- Như trên;\n- Lưu VP.",
    "page_numbers": [
      7
    ]
  }
}