{
  "metadata": {
    "document_id": "7",
    "extraction_time": "2024-12-04T00:13:41.197599",
    "version": "1.0"
  },
  "document_info": {
    "document_type": "Công văn",
    "document_number": "4685-",
    "issue_location": "Hà Nội",
    "issue_date": null,
    "issuing_agency": "BẠN CHÁP HÀNH TRUNG ƯƠNG ĐÁNG CÔNG SẢN VIỆT NAM .\nNHÀ XUÁT BẢN Hà Nội, ngày42_ tháng 10 năm 2017",
    "recipients": "Công ty TNHH In Tiến Bộ,\nM_„zP",
    "recipient_address": null,
    "signer": null,
    "position": null,
    "subject": null,
    "content": "BẠN CHÁP HÀNH TRUNG ƯƠNG ĐÁNG CÔNG SẢN VIỆT NAM .\nNHÀ XUÁT BẢN Hà Nội, ngày42_ tháng 10 năm 2017\nCHÍNH TRỊ QUỐC GIA SỰ THẬT\n\n*\n\nSó ố.24 - CV/NXBCTQG\nW% mời đại điện Lãnh đạo Công tụ TNHH In Tiến Bộ\ntham .. + Nhà \"àa tới ai công tác tại Lào\n\n‡hỉ Hai Kính gửi: Công ty TNHH In Tiến Bộ,\nM_„zP\n\nNgày 01-9-2017, Văn phòng Trung ương Đảng đã có Công văn số 4685-\n\nuư” CEV/VPTW truyền đạt ý kiến của đồng chí Thường trực Ban Bí thư cử đoàn cán bộ\nan (gồm 06 người) do đồng chí Phạm Chí Thành, Quyền Giám đốc -\n\nBiên tập Nhà xuất bản Chính trị quốc gia Sự thật làm Trưởng đoàn đi công\n\nác tại Lào, thời gian 05 ngày, cụ thể như sau:\n\n1. Mục đích chuyến đi: Nhân dịp kỷ niệm 55 năm Ngày thiết lập quan hệ\nngoại giao Việt Nam - Lào và 40 năm Ngày ký Hiệp ước Hữu nghị và Hợp tác\ngiữa Việt Nam - Lào, Lào - Việt Nam, Đoàn liên cơ quan (Nhà xuất bản Chính trị\nquốc gia Sự thật, Cục tài chính và quản lý đầu tư, Văn phòng Trung ương, Công ty\nIn Tiến Bộ) sang thăm và bàn giao các hạng mục của dự án “Đâu £ thiết bị in và\nđào tạo cán bộ biên tập, công nhân in và việc đầu tư nâng cao năng lực biên tập,\nxuẤt bản, in ấn, phát hành” của Đảng và Nhà nước Việt Nam trao tặng cho Nhà\nxuất bản và Phát hành sách Quốc gia Lào;\n\n2. Kế hoạch đoàn đi: Trung tuần tháng 12-2017 (dự kiến từ 10 đến 15-12);\n\n3. Kinh phí: Ngân sách Đảng theo quy định hiện hành.\n\nNhà xuất bản Chính trị quốc gia Sự thật trân trọng đề nghị Công ty TNHH\nIn Tiến Bộ cử 02 đồng chí đại diện lãnh đạo Công ty tham gia Đoàn công tác.\nXin cảm ơn.\n\nNơi nhân:\n- Như trên;\n- Lưu VT.\n\nQ.GIÁM| ĐỐC - TỔNG BIÊN TẬP „_~\n\ná Ấc\n(HÌTRỊgtý (9i U)\n\n^SVTi KỢ,,\ns4 Thành",
    "page_numbers": [
      8
    ]
  }
}