{
  "metadata": {
    "document_id": "4",
    "extraction_time": "2024-12-04T00:13:19.587291",
    "version": "1.0"
  },
  "document_info": {
    "document_type": "quyết định",
    "document_number": "1851-QĐ/VPTW",
    "issue_location": "Hà Nội",
    "issue_date": "12",
    "issuing_agency": "VĂN PHÒNG TRUNG ƯƠNG ĐẲNG CỘNG HOÀ XÃ HỘI CHỦ NGHĨA VIỆT NAM\n: CÔNGTYTNHH ` ._ Độc lập - Tự do - Hạnh phúc",
    "recipients": "- Lãnh đạo Văn phòng Trung ương; Z.\n- Vụ Tổ chức - Cán bộ. .",
    "recipient_address": null,
    "signer": null,
    "position": null,
    "subject": null,
    "content": "VĂN PHÒNG TRUNG ƯƠNG ĐẲNG CỘNG HOÀ XÃ HỘI CHỦ NGHĨA VIỆT NAM\n: CÔNGTYTNHH ` ._ Độc lập - Tự do - Hạnh phúc\n\n- MỘT THÀNH VIÊN IN TIẾN BỘ TT ,\nHà Nội, ngày 01 tháng I1 năm 2017\n\nï\n\nKính gửi: - Lãnh đạo Văn phòng Trung ương; Z.\n- Vụ Tổ chức - Cán bộ. .\n\nuất bản Chính trị Quốc gia Sự thật có văn bản số 621-\n\n\" P /NXCTQG, ngày 12/10/2017 để nghị Công ty In Tiến Bộ cử 2 đồng chí\n\nđạo đi bàn giao dự án \" Đâu tư thiết bị in và đào tạo cán bộ biên tập, công\n\nnhân in và việc đầu tư nâng cao năng lực biên tập, xuất bản, in ấn, phát hành\"\n\n“ế Ƒ và ký biên bản với cáeƠơ quan của Lào làm chứng từ quyết toán dự án được lãnh\nđạo Văn ø Trung ương giao cho Công ty In Tiến Bộ làm chủ đầu tư.\n\nCông ty In Tiến Bộ để nghị lãnh đạo Văn phòng Trung ương cho phép\nđông chí Nguyễn Đức Thanh, Chủ tịch Công ty và đồng chí Hà % Tuấn, Phó\nGiám đốc Công ty tham gia đoàn với Nhà Xuất bản Chính trị Quốc gia Sự thật,\nthời gian dự kiến từ ngày 10/12 đến 15/12/2017. Kinh phí chuyến đi do Ngân\nsách Đảng chỉ theo quy định,\n\nTrường hợp đồng chí Hà Sĩ Tuấn đã được lãnh đạo Văn phòng Trung ương\ncó quyết định cử đi công tác tại Vương Quốc Anh theo lời mời của Công ty Cổ\nphân xuất nhập khẩu ngành ¡in (Quyết định số 1851-QĐ/VPTW, ngày\n12/10/2017). Do Công ty Cổ phân xuất nhập khẩu ngành in có Công văn số 61\nCV-XNKN, ngày 27/10/2017đề nghị hoãn chuyến đi (xin gửi kèm công văn) nên\nđồng chí Hà Sĩ Tuấn đã không tham gia chuyến công tác trên.\n\nKính trình lãnh đạo Văn phòng Trung ương xem xét quyết định.\n\nNơi nhận:\n- Như trên,\n- Lưu Văn phòngCông ty.\n",
    "page_numbers": [
      5
    ]
  }
}